{
  "$schema": "https://json-schema.org/draft/2020-12/schema",
  "$id": "https://easyvibe.dev/schemas/map-v1.json",
  "title": "CodeMap",
  "description": "EasyVibe 语义代码地图数据格式 v1.1（边稳定 id + meta.stats 溯源 + 模块级时间戳；向后兼容）。数据文件存语义，不存布局；布局由渲染器推导。",
  "type": "object",
  "additionalProperties": false,
  "required": [
    "version",
    "meta",
    "layers",
    "modules",
    "edges",
    "health"
  ],
  "properties": {
    "version": {
      "const": "1.0"
    },
    "meta": {
      "type": "object",
      "title": "MapMeta",
      "additionalProperties": false,
      "required": [
        "repo",
        "generated_at",
        "generator"
      ],
      "properties": {
        "repo": {
          "type": "string",
          "minLength": 1,
          "description": "仓库标识（通常为仓库名或根目录名）"
        },
        "generated_at": {
          "type": "string",
          "description": "ISO 8601 时间戳"
        },
        "last_patrol_at": {
          "type": "string",
          "description": "ISO 8601；上次巡检时间，F7 新鲜度提醒依据"
        },
        "stats": {
          "type": "object",
          "description": "溯源统计（finalize 阶段确定性计算，非 LLM 自评）",
          "additionalProperties": false,
          "properties": {
            "files_total": {
              "type": "integer",
              "minimum": 0,
              "description": "产品代码文件总数"
            },
            "files_covered": {
              "type": "integer",
              "minimum": 0,
              "description": "被 modules[].files 覆盖的文件数"
            },
            "coverage_ratio": {
              "type": "number",
              "minimum": 0,
              "maximum": 1,
              "description": "覆盖率"
            },
            "edges_derived": {
              "type": "integer",
              "minimum": 0,
              "description": "确定性推导（import 扫描等）的边数"
            },
            "edges_inferred": {
              "type": "integer",
              "minimum": 0,
              "description": "LLM 断言的边数"
            },
            "retried_modules": {
              "type": "integer",
              "minimum": 0,
              "description": "校验-重试循环中重试过的模块数"
            }
          }
        },
        "generator": {
          "type": "string",
          "description": "生成者标识，格式：agent名/模型名，如 easyvibe-architect/claude-sonnet-4-6"
        },
        "description": {
          "type": "string",
          "description": "全库一句话概述"
        },
        "languages": {
          "type": "array",
          "items": {
            "type": "string"
          },
          "description": "主要编程语言列表"
        },
        "loc": {
          "type": "integer",
          "minimum": 0,
          "description": "估算代码行数"
        },
        "map_freshness": {
          "enum": [
            "fresh",
            "drifting",
            "stale"
          ],
          "description": "fresh=与代码一致；drifting=存在漂移；stale=已明显过期"
        },
        "provenance": {
          "type": "object",
          "title": "MapProvenance",
          "additionalProperties": false,
          "description": "叙事基准（生成期注入，非手写）：prose 中 HEAD <sha> 与生成时间戳的真值源；finalize 用本块填充 prose 模板 token",
          "required": [
            "head_short",
            "generated_at"
          ],
          "properties": {
            "head_short": {
              "type": "string",
              "pattern": "^[0-9a-f]{7,40}$",
              "description": "生成期 HEAD 短 sha（git rev-parse --short HEAD）"
            },
            "generated_at": {
              "type": "string",
              "description": "ISO 8601；生成期时间戳（与 prose 内基准同源）"
            }
          }
        }
      }
    },
    "layers": {
      "type": "array",
      "minItems": 1,
      "description": "矩形分层架构图的层定义，由 LLM 按项目实际结构动态生成（层数、层名、层职责均不预设）。order=0 为最顶层，数字越大越靠底。",
      "items": {
        "type": "object",
        "title": "Layer",
        "additionalProperties": false,
        "required": [
          "id",
          "name",
          "order",
          "description"
        ],
        "properties": {
          "id": {
            "type": "string",
            "pattern": "^[a-z][a-z0-9_-]*$"
          },
          "name": {
            "type": "string",
            "minLength": 1
          },
          "order": {
            "type": "integer",
            "minimum": 0
          },
          "description": {
            "type": "string",
            "description": "该层的职责定义"
          }
        }
      }
    },
    "modules": {
      "type": "array",
      "minItems": 1,
      "items": {
        "type": "object",
        "title": "Module",
        "additionalProperties": false,
        "required": [
          "id",
          "name",
          "layer",
          "responsibility",
          "files",
          "key_entries",
          "dependencies",
          "health"
        ],
        "properties": {
          "id": {
            "type": "string",
            "pattern": "^[a-z][a-z0-9_-]*$",
            "description": "模块唯一标识，小写字母/数字/下划线/中划线"
          },
          "last_analyzed_at": {
            "type": "string",
            "description": "ISO 8601；该模块上次归纳/巡检时间，F7 模块级新鲜度依据"
          },
          "name": {
            "type": "string",
            "minLength": 1,
            "description": "模块显示名，人类可读"
          },
          "layer": {
            "type": "string",
            "description": "所属层 id，必须存在于 layers[]"
          },
          "responsibility": {
            "type": "string",
            "minLength": 1,
            "description": "一句话职责描述"
          },
          "files": {
            "type": "array",
            "minItems": 1,
            "items": {
              "type": "string"
            },
            "description": "归属该模块的文件/目录，glob 路径，相对仓库根"
          },
          "key_entries": {
            "type": "array",
            "description": "关键入口标注",
            "items": {
              "type": "object",
              "title": "KeyEntry",
              "additionalProperties": false,
              "required": [
                "file",
                "symbol",
                "kind"
              ],
              "properties": {
                "file": {
                  "type": "string"
                },
                "symbol": {
                  "type": "string"
                },
                "kind": {
                  "enum": [
                    "function",
                    "class",
                    "interface",
                    "route",
                    "cli",
                    "job",
                    "config"
                  ]
                }
              }
            }
          },
          "dependencies": {
            "type": "array",
            "items": {
              "type": "string"
            },
            "description": "依赖的模块 id 列表；edges[] 中必须有对应 from=本模块 的边"
          },
          "health": {
            "$ref": "#/$defs/health"
          },
          "notes": {
            "type": "string",
            "description": "其他备注（可选）"
          }
        }
      }
    },
    "edges": {
      "type": "array",
      "description": "模块间依赖边，渲染依赖关系的唯一事实来源",
      "items": {
        "type": "object",
        "title": "MapEdge",
        "additionalProperties": false,
        "required": [
          "id",
          "from",
          "to",
          "type",
          "strength"
        ],
        "properties": {
          "id": {
            "type": "string",
            "pattern": "^e[a-z0-9_-]*$",
            "description": "边稳定 id（v1.1 起必填）：供边级证据、置信度、视图引用。按确定性生成序编排（如 e1、e2），重归纳时必须保持稳定"
          },
          "from": {
            "type": "string",
            "description": "起点模块 id"
          },
          "to": {
            "type": "string",
            "description": "终点模块 id"
          },
          "type": {
            "enum": [
              "call",
              "import",
              "api",
              "event",
              "db",
              "config"
            ],
            "description": "call=函数调用；import=代码引用；api=HTTP/RPC；event=消息事件；db=共享数据库；config=运行期配置依赖（不含构建期产物托管/内嵌——后者不连边，判据见 scripts/map_edge_policy.json）"
          },
          "label": {
            "type": "string",
            "description": "边上显示的文字（可选），如方法名"
          },
          "strength": {
            "enum": [
              "strong",
              "normal",
              "weak"
            ],
            "description": "耦合强度估计：strong=频繁/核心路径，weak=偶发"
          },
          "direction_violation": {
            "type": "boolean",
            "description": "true=从下层指向上层的逆向依赖（架构违规信号）"
          }
        }
      }
    },
    "health": {
      "$ref": "#/$defs/health"
    }
  },
  "$defs": {
    "health": {
      "type": "object",
      "title": "Health",
      "additionalProperties": false,
      "required": [
        "score",
        "coupling",
        "complexity",
        "decay_flags"
      ],
      "properties": {
        "score": {
          "type": "integer",
          "minimum": 0,
          "maximum": 100,
          "description": "LLM 综合健康分"
        },
        "coupling": {
          "enum": [
            "low",
            "medium",
            "high",
            "critical"
          ]
        },
        "complexity": {
          "enum": [
            "low",
            "medium",
            "high"
          ]
        },
        "churn": {
          "enum": [
            "low",
            "medium",
            "high"
          ],
          "description": "近期变更频率，LLM 依据 git 历史判断"
        },
        "decay_flags": {
          "type": "array",
          "items": {
            "type": "string"
          },
          "description": "腐化标记，模块级如 coupling_high, god_module, circular_dep；架构级如 layer_violation, responsibility_overlap, layering_mismatch"
        },
        "review_note": {
          "type": "string",
          "description": "LLM 给出的改进建议"
        },
        "concerns": {
          "type": "array",
          "maxItems": 3,
          "description": "LLM 提名最值得关注的 top-3 问题（架构级与模块级共用结构）",
          "items": {
            "type": "object",
            "title": "Concern",
            "additionalProperties": false,
            "required": [
              "severity",
              "finding",
              "suggestion"
            ],
            "properties": {
              "severity": {
                "enum": [
                  "critical",
                  "high"
                ],
                "description": "critical=建议尽快处理；high=值得关注"
              },
              "finding": {
                "type": "string",
                "description": "现状：一句话说清问题是什么"
              },
              "suggestion": {
                "type": "string",
                "description": "建议：一句话给出改法"
              },
              "id": {
                "type": "string",
                "description": "稳定标识：c-arch-N（架构级）/ c-<module_id>-N（模块级）；巡检继承上轮同问题 id"
              }
            }
          }
        }
      },
      "description": "架构级 LLM 评估（跨模块耦合形态、分层合理性、逆向依赖密度、职责重叠/缺失）；模块全绿 ≠ 架构健康，须独立评估"
    }
  }
}