{
  "version": "1.0",
  "meta": {
    "repo": "hover-client",
    "generated_at": "2026-09-29T00:00:00+08:00",
    "generator": "easyvibe-architect/deepseek-v4.1-flash",
    "description": "Hover 英语口语练习 Flutter 客户端：考试会话与录音评测、报告生成与导出、账户订阅、练习训练，经 core-auth-service 网关与后端交互。",
    "languages": [
      "Dart"
    ],
    "loc": 144389,
    "map_freshness": "fresh"
  },
  "layers": [
    {
      "id": "app-entry",
      "name": "应用装配层",
      "order": 0,
      "description": "进程入口与组合根：main_<env>.dart 按编译期环境启动，hover_app.dart 手工装配全部服务并注入界面树"
    },
    {
      "id": "presentation",
      "name": "界面呈现层",
      "order": 1,
      "description": "桌面/移动页面与通用组件、主题、用户文案与路由常量、HTML 文档渲染，直接调用应用服务与网关"
    },
    {
      "id": "application",
      "name": "应用服务层",
      "order": 2,
      "description": "考试会话编排、评测提交、报告生成、账户认证、练习训练等领域流程编排与领域模型"
    },
    {
      "id": "shared-state",
      "name": "共享状态层",
      "order": 3,
      "description": "跨功能共享的应用偏好、桌面设置操作与外壳导航状态"
    },
    {
      "id": "infrastructure",
      "name": "基础设施层",
      "order": 4,
      "description": "网关 HTTP 客户端与 wire 契约、音频采集播放、本地文件存储与平台系统能力（更新/日志/诊断/遥测）"
    },
    {
      "id": "foundation",
      "name": "基础支撑层",
      "order": 5,
      "description": "编译期环境配置与多语言生成资源，零库内依赖的叶子层"
    }
  ],
  "modules": [
    {
      "id": "app-composition",
      "name": "应用装配",
      "layer": "app-entry",
      "responsibility": "应用启动引导、运行环境校验与全部服务的组合根装配",
      "files": [
        "lib/main.dart",
        "lib/main_local.dart",
        "lib/main_staging.dart",
        "lib/main_production.dart",
        "lib/app/hover_app.dart",
        "lib/app/composition/**",
        "lib/app/local_test_auto_login_policy.dart",
        "lib/debug/**"
      ],
      "key_entries": [
        {
          "file": "lib/main.dart",
          "symbol": "bootstrap",
          "kind": "function"
        },
        {
          "file": "lib/main_staging.dart",
          "symbol": "main",
          "kind": "cli"
        },
        {
          "file": "lib/app/hover_app.dart",
          "symbol": "HoverApp",
          "kind": "class"
        },
        {
          "file": "lib/app/composition/desktop_feature_services.dart",
          "symbol": "DesktopFeatureServices",
          "kind": "class"
        }
      ],
      "dependencies": [
        "exam-core",
        "practice-training",
        "reporting",
        "shared-ui",
        "app-state",
        "device-services",
        "shared-foundation",
        "account-auth",
        "desktop-ui",
        "gateway-network"
      ],
      "health": {
        "score": 63,
        "coupling": "high",
        "complexity": "high",
        "churn": "medium",
        "decay_flags": [
          "god_module",
          "coupling_high",
          "circular_dep"
        ],
        "review_note": "hover_app.dart 单文件 1343 行、23 个可选构造参数与 43 个 late final 服务字段，生产路径下无参构造即自行 new 出全部依赖，是 12 个模块中依赖面最宽的一个（出边 10 条）；与界面层构成双向依赖（装配 MainLayout，而 main_layout/desktop_main_layout 又回引 DesktopFeatureServices）。近 90 天 79 次文件改动。建议按功能域把组装逻辑拆成多个 composition 单元，并把 DesktopFeatureServices 容器下移到应用层，界面只接收抽象。",
        "concerns": [
          {
            "severity": "high",
            "finding": "hover_app.dart 1343 行内手工 new 出 43 个服务，是全库唯一的组装点，任何新服务都必须改这一个文件。",
            "suggestion": "按域拆成 account/exam/reporting/practice 等多个 composition 单元，hover_app.dart 只保留编排与生命周期策略。"
          },
          {
            "severity": "high",
            "finding": "组合根与界面层互为依赖：组合根装配 MainLayout，而 main_layout.dart:10 与 desktop_main_layout.dart:10 又反向 import app/composition/desktop_feature_services.dart。",
            "suggestion": "把 DesktopFeatureServices 容器移到应用层的独立文件，界面只接收注入的抽象接口，断开组合根与界面层之间的环。"
          }
        ]
      },
      "last_analyzed_at": "2026-09-29T00:00:00+08:00"
    },
    {
      "id": "desktop-ui",
      "name": "桌面端界面",
      "layer": "presentation",
      "responsibility": "桌面端页面、工作区与桌面专用组件的呈现与交互",
      "files": [
        "lib/views/desktop/**",
        "lib/widgets/desktop/**"
      ],
      "key_entries": [
        {
          "file": "lib/views/desktop/shell/shell_layout.dart",
          "symbol": "DesktopMainLayout",
          "kind": "class"
        },
        {
          "file": "lib/views/desktop/exam/exam_layout.dart",
          "symbol": "ExamView",
          "kind": "class"
        },
        {
          "file": "lib/views/desktop/result/result_layout.dart",
          "symbol": "ResultView",
          "kind": "class"
        },
        {
          "file": "lib/views/desktop/setup/setup_layout.dart",
          "symbol": "SetupView",
          "kind": "class"
        },
        {
          "file": "lib/views/desktop/reports/reports_layout.dart",
          "symbol": "ReportsManagerView",
          "kind": "class"
        },
        {
          "file": "lib/widgets/desktop/desktop_view_topology.dart",
          "symbol": "DesktopPageTopology",
          "kind": "class"
        }
      ],
      "dependencies": [
        "shared-ui",
        "app-state",
        "exam-core",
        "reporting",
        "account-auth",
        "practice-training",
        "shared-foundation",
        "device-services",
        "gateway-network",
        "app-composition"
      ],
      "health": {
        "score": 58,
        "coupling": "high",
        "complexity": "high",
        "churn": "high",
        "decay_flags": [
          "coupling_high",
          "layer_violation",
          "god_module"
        ],
        "review_note": "83 文件 22917 行，近 90 天 449 次文件改动为全库最热；采用「聚合文件 + part 子文件」组织（desktop_exam_view/desktop_result_view 各挂 5-8 个 part），presenter 只是 _ViewState 的 extension，业务逻辑仍写在 State 内。视图直接 import 并调用 application 服务与 infrastructure/network 的 DTO，甚至按需捕获 GatewayException，没有视图模型隔离层。建议先收敛对网关 DTO 的直接依赖，再把 part 化的 presenter 提升为独立视图模型。",
        "concerns": [
          {
            "severity": "high",
            "finding": "视图 State 直接调用 application 服务与网关客户端类型，presenter 仅为 State 的 extension，业务逻辑与 UI 状态无法分别测试。",
            "suggestion": "把 result/exam/reports 的 presenter 提升为独立 ChangeNotifier 视图模型，视图只消费状态快照。"
          },
          {
            "severity": "high",
            "finding": "desktop_main_layout.dart:10 反向 import 组合根 app/composition/desktop_feature_services.dart（presentation → app-entry）。",
            "suggestion": "将桌面服务容器移到应用层，通过构造参数以接口形式注入。"
          }
        ]
      },
      "last_analyzed_at": "2026-09-29T00:00:00+08:00"
    },
    {
      "id": "mobile-ui",
      "name": "移动端界面",
      "layer": "presentation",
      "responsibility": "移动端页面、场景壳与移动专用组件的呈现与交互",
      "files": [
        "lib/views/mobile/**",
        "lib/widgets/mobile/**"
      ],
      "key_entries": [
        {
          "file": "lib/views/mobile/mobile_main_layout.dart",
          "symbol": "MobileMainLayout",
          "kind": "class"
        },
        {
          "file": "lib/views/mobile/mobile_exam_page.dart",
          "symbol": "MobileExamPage",
          "kind": "class"
        },
        {
          "file": "lib/views/mobile/mobile_result_view.dart",
          "symbol": "ResultView",
          "kind": "class"
        },
        {
          "file": "lib/views/mobile/mobile_account_view.dart",
          "symbol": "MobileAccountView",
          "kind": "class"
        },
        {
          "file": "lib/widgets/mobile/mobile_scene_shell.dart",
          "symbol": "MobileSceneSwitcherSheet",
          "kind": "class"
        }
      ],
      "dependencies": [
        "shared-ui",
        "app-state",
        "exam-core",
        "reporting",
        "account-auth",
        "practice-training",
        "shared-foundation",
        "device-services",
        "gateway-network"
      ],
      "health": {
        "score": 58,
        "coupling": "high",
        "complexity": "high",
        "churn": "high",
        "decay_flags": [
          "coupling_high",
          "god_module"
        ],
        "review_note": "33 文件 24700 行，单文件均值 748 行：mobile_exam_page.dart 3860 行、mobile_editorial_reports_view.dart 2513 行，考试流程、练习与 UI 状态集中在同一 State；近 90 天 352 次文件改动。移动端与桌面端各自实现了一套页面与状态逻辑，共享的只有 shared-ui 的组件与展示映射，改动常需双端同步。建议先拆分 mobile_exam_page 的 State，再评估把双端共有的会话展示逻辑上移到 shared-ui。",
        "concerns": [
          {
            "severity": "high",
            "finding": "mobile_exam_page.dart 单文件 3860 行（全库最大），考试/练习流程与 UI 状态混在一个 State 中。",
            "suggestion": "按答题、准备、交卷契约把该文件拆成独立页面与视图模型，状态提升到单一 controller。"
          },
          {
            "severity": "high",
            "finding": "桌面端与移动端各自实现一套页面逻辑，shared-ui 只沉淀了组件与文案，行为改动需要双端重复实现。",
            "suggestion": "把双端共有的会话/报告展示逻辑抽到 shared-ui 的展示映射层，两端只保留布局差异。"
          }
        ]
      },
      "last_analyzed_at": "2026-09-29T00:00:00+08:00"
    },
    {
      "id": "shared-ui",
      "name": "共享界面资源",
      "layer": "presentation",
      "responsibility": "主题、用户文案、路由常量、展示映射与跨端公共组件",
      "files": [
        "lib/views/main_layout.dart",
        "lib/widgets/*.dart",
        "lib/theme/**",
        "lib/utils/**",
        "lib/presentation/**",
        "lib/app/app_strings.dart",
        "lib/app/hover_app_route.dart",
        "lib/app/device_route_middleware.dart",
        "lib/app/scenario_info_resources.dart",
        "lib/application/documents/**",
        "lib/infrastructure/documents/**"
      ],
      "key_entries": [
        {
          "file": "lib/views/main_layout.dart",
          "symbol": "MainLayout",
          "kind": "class"
        },
        {
          "file": "lib/app/app_strings.dart",
          "symbol": "AppStrings",
          "kind": "class"
        },
        {
          "file": "lib/app/hover_app_route.dart",
          "symbol": "HoverAppRoute",
          "kind": "route"
        },
        {
          "file": "lib/theme/app_theme.dart",
          "symbol": "AppTheme",
          "kind": "class"
        },
        {
          "file": "lib/widgets/exam_report_viewer.dart",
          "symbol": "ExamReportViewer",
          "kind": "class"
        },
        {